{
  "processor": "stripe",
  "processor_event_id": "evt_1PZQaBcDeFgHiJkLmNoPqR7",
  "kind": "payment",
  "customer_id": "cus_R1pQKz9xLp2mN4vB6yH8jL0",
  "checkout_session_id": "cs_test_b1PZQaBcDeFgHiJkLmNoP",
  "payment_intent_id": "pi_3PZQaBcDeFgHiJkLmNoPqRd",
  "client_reference_id": "11111111-1111-4111-8111-111111111111",
  "paid": true,
  "amount": {
    "amount_minor": 1500,
    "currency": "USD"
  }
}